Data Structure                       ,Description                                                                                         ,Use Cases                                        ,Time Complexity                                               ,Space Complexity                            ,Advantages                           ,Disadvantages                                ,Example Implementation                            ,Common Operations              ,Best Use Cases
Arrays                               ,A collection of elements identified by index or key.                                                ,Storing fixed-size collections                   ,Accessing elements by index: O(1)                             ,Insertion/Deletion: O(n)                    ,O(n)                                 ,Fast access by index                         ,Fixed size can lead to wasted space.              ,Array in C/C++                 ,Python lists              ,Access                                           ,Insert                                         ,Delete                                                  ,When the size of data is known and fixed
Static Array                         ,An array with a fixed size determined at compile time.                                              ,Storing constants or configuration values        ,Accessing elements: O(1)                                      ,O(n)                                        ,Simple implementation                ,Inflexible size.                             ,C/C++ arrays                                      ,Access                         ,Insert (not possible)     ,Delete (not possible)                            ,When performance is critical and size is known
Dynamic Array                        ,An array that can resize itself during runtime.                                                     ,Implementing lists that grow/shrink              ,Accessing elements: O(1)                                      ,Amortized Insertion: O(1)                   ,Deletion: O(n)                       ,O(n)                                         ,Flexible size                                     ,Overhead for resizing.         ,Python lists              ,Java ArrayList                                   ,Access                                         ,Insert                                                  ,Delete                                                 ,When the size of data can change frequently
Multidimensional Array               ,An array with more than one dimension (e.g.                                                         ,2D arrays).                                      ,Representing matrices or grids                                ,Accessing elements: O(1)                    ,O(n*m) for space                     ,Direct access to elements                    ,Memory-intensive for large sizes.                 ,2D arrays in C/C++             ,Python nested lists       ,Access                                           ,Insert                                         ,Delete                                                  ,When working with mathematical matrices or images
Linked Lists                         ,A linear collection of data elements                                                                ,where each element points to the next.           ,Implementing stacks                                           ,queues                                      ,and adjacency lists                  ,Insertion/Deletion: O(1)                     ,Search: O(n)                                      ,O(n)                           ,Dynamic size              ,No direct access to elements.                    ,Linked lists in C/C++                          ,Insert                                                  ,Delete                                                 ,Search                                      ,When frequent insertions and deletions are required
Singly Linked List                   ,A linked list where each node points to the next node only.                                         ,Implementing simple stacks and queues            ,Insertion/Deletion: O(1)                                      ,Search: O(n)                                ,O(n)                                 ,Simple structure                             ,Inefficient search.                               ,Singly linked lists in C/C++   ,Insert                    ,Delete                                           ,Search                                         ,When memory efficiency is needed with simple operations
Doubly Linked List                   ,A linked list where each node points to both the next and previous nodes.                           ,Implementing complex data structures like deques ,Insertion/Deletion: O(1)                                      ,Search: O(n)                                ,O(n)                                 ,Bidirectional traversal                      ,More memory overhead.                             ,Doubly linked lists in C/C++   ,Insert                    ,Delete                                           ,Search                                         ,When bidirectional traversal is needed
Circular Linked List                 ,A linked list where the last node points back to the first node.                                    ,Implementing circular queues                     ,Insertion/Deletion: O(1)                                      ,Search: O(n)                                ,O(n)                                 ,Efficient for circular traversal             ,Complex implementation.                           ,Circular linked lists in C/C++ ,Insert                    ,Delete                                           ,Search                                         ,When implementing circular data structures
Skip List                            ,A layered linked list that allows for fast search                                                   ,insertion                                        ,and deletion.                                                 ,Implementing sorted collections             ,Search/Insertion/Deletion: O(log n)  ,O(n)                                         ,Fast search times                                 ,Requires additional space.     ,Skip lists in C++         ,Insert                                           ,Delete                                         ,Search                                                  ,When a balanced search time is needed with sorted data
Stacks                               ,A collection of elements that follows the Last In First Out (LIFO) principle.                       ,Function call management                         ,Undo mechanisms                                               ,Push/Pop: O(1)                              ,O(n)                                 ,Simple operations                            ,Limited access to elements.                       ,Stacks in C/C++                ,Python lists              ,Push                                             ,Pop                                            ,Peek                                                    ,When managing function calls or backtracking
Standard Stack                       ,A basic stack implementation using arrays or linked lists.                                          ,Managing function calls                          ,Push/Pop: O(1)                                                ,O(n)                                        ,Easy to implement                    ,Fixed size in array implementation.          ,Stacks in C/C++                                   ,Push                           ,Pop                       ,Peek                                             ,When the maximum size is known
Array-based Stack                    ,A stack implemented using a dynamic array.                                                          ,Managing function calls with dynamic size        ,Push/Pop: O(1)                                                ,O(n)                                        ,Dynamic resizing                     ,Overhead for resizing.                       ,Dynamic arrays in Java                            ,Python lists                   ,Push                      ,Pop                                              ,Peek                                           ,When flexibility is needed in size
Linked List-based Stack              ,A stack implemented using a linked list.                                                            ,Managing function calls with linked memory       ,Push/Pop: O(1)                                                ,O(n)                                        ,No fixed size                        ,More memory overhead.                        ,Linked lists in C/C++                             ,Push                           ,Pop                       ,Peek                                             ,When frequent resizing is expected
Queues                               ,A collection of elements that follows the First In First Out (FIFO) principle.                      ,Task scheduling                                  ,Buffering                                                     ,Enqueue/Dequeue: O(1)                       ,O(n)                                 ,Fair processing order                        ,Limited access to elements.                       ,Queues in C/C++                ,Python collections        ,Enqueue                                          ,Dequeue                                        ,Peek                                                    ,When processing tasks in order is required
Standard Queue                       ,A basic queue implementation using arrays or linked lists.                                          ,Managing tasks in order                          ,Enqueue/Dequeue: O(1)                                         ,O(n)                                        ,Simple implementation                ,Fixed size in array implementation.          ,Queues in C/C++                                   ,Enqueue                        ,Dequeue                   ,Peek                                             ,When the maximum size is known
Circular Queue                       ,A queue that wraps around to the beginning when it reaches the end.                                 ,Implementing buffering                           ,Enqueue/Dequeue: O(1)                                         ,O(n)                                        ,Efficient use of space               ,More complex implementation.                 ,Circular queues in C/C++                          ,Enqueue                        ,Dequeue                   ,Peek                                             ,When memory efficiency is critical
Priority Queue                       ,A queue where each element has a priority                                                           ,and elements are served based on priority.       ,Task scheduling based on priority                             ,Insertion: O(log n)                         ,Deletion: O(log n)                   ,O(n)                                         ,Efficient for priority handling                   ,Slower than regular queues.    ,Priority queues in C++    ,Java PriorityQueue                               ,Enqueue                                        ,Dequeue                                                 ,Peek                                                   ,When tasks have different priorities
Deque (Double-ended Queue)           ,A queue that allows insertion and deletion from both ends.                                          ,Implementing palindromes                         ,Enqueue/Dequeue: O(1)                                         ,O(n)                                        ,Flexible access                      ,More complex than standard queues.           ,Deques in C++                                     ,Python collections             ,Enqueue                   ,Dequeue                                          ,Peek                                           ,When both ends need to be accessed frequently
Trees                                ,A hierarchical data structure consisting of nodes connected by edges.                               ,Representing hierarchical data                   ,Search/Insertion/Deletion: O(log n) for balanced trees        ,O(n)                                        ,Hierarchical representation          ,Can become unbalanced.                       ,Trees in C++                                      ,Java                           ,Insert                    ,Delete                                           ,Search                                         ,When representing hierarchical relationships
Binary Tree                          ,A tree where each node has at most two children.                                                    ,Implementing binary search trees                 ,Search/Insertion/Deletion: O(n) for unbalanced                ,O(n)                                        ,Simple structure                     ,Inefficient for large datasets.              ,Binary trees in C++                               ,Java                           ,Insert                    ,Delete                                           ,Search                                         ,When simplicity is preferred over efficiency
Binary Search Tree (BST)             ,A binary tree where the left child is less than the parent and the right child is greater.          ,Implementing sorted data retrieval               ,Search/Insertion/Deletion: O(log n) for balanced              ,O(n)                                        ,Efficient for sorted data            ,Can become unbalanced.                       ,BST in C++                                        ,Java                           ,Insert                    ,Delete                                           ,Search                                         ,When quick search and retrieval are needed
Balanced Trees                       ,Trees that maintain a balanced height for efficient operations.                                     ,Implementing dynamic sorted collections          ,Search/Insertion/Deletion: O(log n)                           ,O(n)                                        ,Always balanced                      ,More complex to implement.                   ,AVL trees in C++                                  ,Red-Black trees in Java        ,Insert                    ,Delete                                           ,Search                                         ,When consistent performance is required
AVL Tree                             ,A self-balancing binary search tree where the heights of two child subtrees differ by at most one.  ,Implementing dynamic sorted collections          ,Search/Insertion/Deletion: O(log n)                           ,O(n)                                        ,Guarantees balance                   ,More rotations required during insertion.    ,AVL trees in C++                                  ,Insert                         ,Delete                    ,Search                                           ,When strict balancing is needed
Red-Black Tree                       ,A balanced binary search tree with properties to ensure balance during insertions and deletions.    ,Implementing associative arrays                  ,Search/Insertion/Deletion: O(log n)                           ,O(n)                                        ,Efficient balancing                  ,More complex properties.                     ,Red-Black trees in C++                            ,Insert                         ,Delete                    ,Search                                           ,When frequent insertions and deletions occur
Splay Tree                           ,A self-adjusting binary search tree that moves frequently accessed elements closer to the root.     ,Optimizing access patterns                       ,Search/Insertion/Deletion: O(log n) amortized                 ,O(n)                                        ,Adaptive to access patterns          ,Can become unbalanced.                       ,Splay trees in C++                                ,Insert                         ,Delete                    ,Search                                           ,When access patterns are predictable
B-Trees                              ,A self-balancing tree data structure that maintains sorted data and allows searches                 ,sequential access                                ,and insertions.                                               ,Database indexing                           ,Search/Insertion/Deletion: O(log n)  ,O(n)                                         ,Efficient for disk storage                        ,More complex structure.        ,B-Trees in databases      ,Insert                                           ,Delete                                         ,Search                                                  ,When used in databases for efficient data retrieval
B+ Trees                             ,A type of B-tree where all values are stored at the leaf level                                      ,allowing for efficient range queries.            ,Database indexing                                             ,Search: O(log n)                            ,Range queries: O(n)                  ,O(n)                                         ,Efficient for range queries                       ,More complex to implement.     ,B+ Trees in databases     ,Insert                                           ,Delete                                         ,Search                                                  ,When range queries are frequent
Segment Tree                         ,A tree used for storing intervals or segments                                                       ,allowing efficient range queries.                ,Range queries and updates                                     ,Query: O(log n)                             ,Update: O(log n)                     ,O(n)                                         ,Efficient for range queries                       ,More complex to implement.     ,Segment trees in C++      ,Insert                                           ,Delete                                         ,Query                                                   ,When performing range queries on static data
Suffix Tree                          ,A compressed trie containing all suffixes of a given string.                                        ,Fast substring search                            ,Construction: O(n)                                            ,Search: O(m)                                ,O(n)                                 ,Efficient substring search                   ,High memory usage.                                ,Suffix trees in C++            ,Insert                    ,Search                                           ,When substring searching is required
Trie                                 ,A tree-like data structure used for storing a dynamic set of strings.                               ,Autocomplete features                            ,Search/Insertion: O(m) where m is the length of the string    ,O(n*m)                                      ,Fast prefix search                   ,High memory usage for large datasets.        ,Tries in C++                                      ,Insert                         ,Search                    ,When implementing prefix-based searches
Compressed Trie                      ,A trie with nodes that can represent multiple characters to save space.                             ,Efficient prefix searching                       ,Search/Insertion: O(m)                                        ,O(n*m)                                      ,Space-efficient                      ,More complex implementation.                 ,Compressed tries in C++                           ,Insert                         ,Search                    ,When memory efficiency is critical
Graphs                               ,A collection of nodes (vertices) and edges connecting them.                                         ,Representing networks                            ,Search/Traversal: O(V + E)                                    ,O(V + E)                                    ,Flexible representation              ,Complex algorithms for operations.           ,Graphs in C++                                     ,Python NetworkX                ,Insert                    ,Delete                                           ,Search                                         ,When modeling relationships between entities
Directed Graph                       ,A graph where edges have a direction from one vertex to another.                                    ,Representing one-way relationships               ,Search/Traversal: O(V + E)                                    ,O(V + E)                                    ,Efficient for directed relationships ,More complex traversal.                      ,Directed graphs in C++                            ,Insert                         ,Delete                    ,Search                                           ,When directionality is important
Undirected Graph                     ,A graph where edges have no direction                                                               ,allowing movement in both directions.            ,Representing two-way relationships                            ,Search/Traversal: O(V + E)                  ,O(V + E)                             ,Simple traversal                             ,Less efficient for large datasets.                ,Undirected graphs in C++       ,Insert                    ,Delete                                           ,Search                                         ,When relationships are bidirectional
Weighted Graph                       ,A graph where edges have weights representing costs or distances.                                   ,Shortest path algorithms                         ,Search/Traversal: O(V + E)                                    ,O(V + E)                                    ,Useful for pathfinding               ,More complex to manage.                      ,Weighted graphs in C++                            ,Insert                         ,Delete                    ,Search                                           ,When costs or distances are relevant
Unweighted Graph                     ,A graph where edges do not have weights.                                                            ,Simple pathfinding                               ,Search/Traversal: O(V + E)                                    ,O(V + E)                                    ,Simple implementation                ,Limited use cases.                           ,Unweighted graphs in C++                          ,Insert                         ,Delete                    ,Search                                           ,When cost is not a factor
Adjacency List Representation        ,A representation of a graph using a list of adjacent vertices for each vertex.                      ,Efficient for sparse graphs                      ,Space: O(V + E)                                               ,O(V)                                        ,Space-efficient                      ,Slower for dense graphs.                     ,Adjacency lists in C++                            ,Insert                         ,Delete                    ,Search                                           ,When the graph is sparse
Adjacency Matrix Representation      ,A 2D array representation of a graph where rows and columns represent vertices.                     ,Efficient for dense graphs                       ,Space: O(V^2)                                                 ,O(V^2)                                      ,Fast access to edges                 ,High space usage for sparse graphs.          ,Adjacency matrices in C++                         ,Insert                         ,Delete                    ,Search                                           ,When the graph is dense
Incidence Matrix Representation      ,A matrix representation showing the relationship between edges and vertices.                        ,Representing bipartite graphs                    ,Space: O(V * E)                                               ,O(V * E)                                    ,Simple representation                ,Inefficient for large graphs.                ,Incidence matrices in C++                         ,Insert                         ,Delete                    ,Search                                           ,When dealing with bipartite graphs
Hash Tables                          ,A data structure that implements an associative array                                               ,mapping keys to values.                          ,Fast data retrieval                                           ,Average: O(1) for search/insertion/deletion ,O(n)                                 ,Fast lookups                                 ,Collision handling can complicate implementation. ,Hash tables in C++             ,Python dictionaries       ,Insert                                           ,Delete                                         ,Search                                                  ,When fast access to data is required
