Data Structure                       ,Description                                                                                         ,Use Cases                                        ,Time Complexity                                               ,Space Complexity                            ,Advantages                           ,Disadvantages                                ,Example Implementation                            ,Common Operations              ,Best Use Cases
Hash Map                             ,A hash table that allows for fast retrieval of values based on keys.                                ,Implementing dictionaries                        ,Average: O(1)                                                 ,O(n)                                        ,Efficient for key-value pairs        ,Can have performance issues with collisions. ,Hash maps in Java                                 ,Insert                         ,Delete                    ,Search                                           ,When key-value storage is needed
Hash Set                             ,A hash table that stores unique values without any associated keys.                                 ,Implementing unique collections                  ,Average: O(1)                                                 ,O(n)                                        ,Fast membership testing              ,No duplicate values allowed.                 ,Hash sets in Java                                 ,Insert                         ,Delete                    ,Search                                           ,When uniqueness of elements is required
Perfect Hashing                      ,A hashing technique that guarantees constant time complexity for lookups.                           ,Implementing static sets                         ,Average: O(1)                                                 ,O(n)                                        ,Very fast lookups                    ,Requires knowledge of data in advance.       ,Perfect hashing in C++                            ,Insert                         ,Search                    ,When the dataset is static and known
Heaps                                ,A specialized tree-based data structure that satisfies the heap property.                           ,Implementing priority queues                     ,Insert/Delete: O(log n)                                       ,O(n)                                        ,Efficient priority handling          ,Not suitable for sorted order retrieval.     ,Heaps in C++                                      ,Java                           ,Insert                    ,Delete                                           ,Peek                                           ,When managing dynamic priorities
Min Heap                             ,A binary tree where the parent node is less than or equal to its child nodes.                       ,Implementing priority queues                     ,Insert/Delete: O(log n)                                       ,O(n)                                        ,Efficient for finding minimum        ,Not suitable for finding maximum.            ,Min heaps in C++                                  ,Insert                         ,Delete                    ,Peek                                             ,When the minimum element is needed frequently
Max Heap                             ,A binary tree where the parent node is greater than or equal to its child nodes.                    ,Implementing priority queues                     ,Insert/Delete: O(log n)                                       ,O(n)                                        ,Efficient for finding maximum        ,Not suitable for finding minimum.            ,Max heaps in C++                                  ,Insert                         ,Delete                    ,Peek                                             ,When the maximum element is needed frequently
Fibonacci Heap                       ,A heap data structure that supports a collection of trees and allows for efficient merging.         ,Optimizing Dijkstra's algorithm                  ,Insert: O(1)                                                  ,Delete: O(log n)                            ,O(n)                                 ,Amortized efficiency                         ,More complex to implement.                        ,Fibonacci heaps in C++         ,Insert                    ,Delete                                           ,Merge                                          ,When merging heaps frequently
Binomial Heap                        ,A collection of binomial trees that supports efficient merging.                                     ,Merging heaps efficiently                        ,Insert/Delete: O(log n)                                       ,O(n)                                        ,Efficient for merging                ,More complex structure.                      ,Binomial heaps in C++                             ,Insert                         ,Delete                    ,Merge                                            ,When efficient merging is required
Pairing Heap                         ,A type of heap that is simple to implement and offers good amortized performance.                   ,General-purpose priority queues                  ,Insert/Delete: O(log n) amortized                             ,O(n)                                        ,Simple implementation                ,Performance can vary.                        ,Pairing heaps in C++                              ,Insert                         ,Delete                    ,Merge                                            ,When simplicity is preferred
Specialized Data Structures          ,Data structures designed for specific applications or optimizations.                                ,Various applications                             ,Varies by structure                                           ,Varies by structure                         ,Tailored for specific tasks          ,May not be generalizable.                    ,Varies by structure                               ,Varies by structure            ,When specific needs arise
Disjoint Set (Union-Find)            ,A data structure that keeps track of a partition of a set into disjoint subsets.                    ,Network connectivity                             ,Union/Find: O(α(n)) where α is the inverse Ackermann function ,O(n)                                        ,Efficient for dynamic connectivity   ,Not suitable for non-disjoint sets.          ,Union-Find in C++                                 ,Find                           ,Union                     ,When managing connected components
K-D Trees                            ,A space-partitioning data structure for organizing points in a k-dimensional space.                 ,Nearest neighbor searches                        ,Search: O(log n) average                                      ,O(n)                                        ,Efficient for multi-dimensional data ,Can become unbalanced.                       ,K-D trees in C++                                  ,Insert                         ,Delete                    ,Search                                           ,When searching in multi-dimensional spaces
Quad Trees                           ,A tree data structure used to partition a two-dimensional space by recursively subdividing it.      ,Spatial indexing                                 ,Insert/Search: O(log n) average                               ,O(n)                                        ,Efficient for 2D spatial data        ,More complex for dynamic data.               ,Quad trees in C++                                 ,Insert                         ,Delete                    ,Search                                           ,When managing 2D spatial data
Octrees                              ,A tree data structure used to partition a three-dimensional space.                                  ,3D spatial indexing                              ,Insert/Search: O(log n) average                               ,O(n)                                        ,Efficient for 3D spatial data        ,More complex for dynamic data.               ,Octrees in C++                                    ,Insert                         ,Delete                    ,Search                                           ,When managing 3D spatial data
Suffix Arrays                        ,A sorted array of all suffixes of a given string.                                                   ,Efficient substring searching                    ,Construction: O(n log n)                                      ,Search: O(m)                                ,O(n)                                 ,Space-efficient                              ,Slower construction time.                         ,Suffix arrays in C++           ,Insert                    ,Search                                           ,When substring searching is required
Interval Trees                       ,A tree data structure that stores intervals and allows efficient querying of overlapping intervals. ,Scheduling problems                              ,Query: O(log n)                                               ,O(n)                                        ,Efficient for overlapping queries    ,More complex implementation.                 ,Interval trees in C++                             ,Insert                         ,Delete                    ,Query                                            ,When managing overlapping intervals
Binary Indexed Trees (Fenwick Trees) ,A data structure that provides efficient methods for cumulative frequency tables.                   ,Range sum queries                                ,Update/Query: O(log n)                                        ,O(n)                                        ,Efficient for cumulative frequency   ,Limited to prefix sums.                      ,Fenwick trees in C++                              ,Update                         ,Query                     ,When performing range sum queries
Ropes                                ,A data structure used for efficiently storing and manipulating long strings.                        ,Text editing applications                        ,Insert/Delete: O(log n)                                       ,O(n)                                        ,Efficient for large strings          ,More complex implementation.                 ,Ropes in C++                                      ,Insert                         ,Delete                    ,Access                                           ,When editing large texts
Matrices                             ,A two-dimensional array used for mathematical computations.                                         ,Mathematical modeling                            ,Access: O(1)                                                  ,O(n*m)                                      ,Direct access to elements            ,Memory-intensive for large sizes.            ,Matrices in C++                                   ,Insert                         ,Delete                    ,Access                                           ,When performing matrix operations
Sparse Matrix                        ,A matrix in which most of the elements are zero.                                                    ,Efficient storage of large matrices              ,Access: O(n)                                                  ,O(n*m)                                      ,Space-efficient                      ,Complexity in operations.                    ,Sparse matrices in C++                            ,Insert                         ,Access                    ,When dealing with large datasets with many zeros
Dense Matrix                         ,A matrix in which most of the elements are non-zero.                                                ,Mathematical computations                        ,Access: O(1)                                                  ,O(n*m)                                      ,Efficient for computations           ,High space usage.                            ,Dense matrices in C++                             ,Insert                         ,Access